{
  "schemaVersion": 1,
  "status": "NOT_APPLICABLE",
  "applicability": "NON_VOICE",
  "candidate": "d03b81d06515e6a94fc40c3f8c39232ba4bdaeb9",
  "reviewerId": "instinct-watcher (agent-01M2GF8HX1XMP5TP0PTRNYH5JX, independent of patch author)",
  "reason": "candidate ships no voice or call feature; it adds the Voice/Call Proof STANDARD and receipt contract that future voice candidates must satisfy",
  "generatedAt": "2026-09-17T03:52:59.467672+00:00"
}
